{"$schema":"https://json-schema.org/draft/2020-12/schema","title":"Agentic Harness Profile","type":"object","required":["format_version","name","maturity","packs","skills","policies"],"properties":{"format_version":{"const":1},"name":{"type":"string","minLength":1},"maturity":{"enum":["prototype","startup","production","critical"]},"packs":{"type":"array","items":{"type":"string"},"uniqueItems":true},"skills":{"type":"array","items":{"type":"string"},"uniqueItems":true},"policies":{"type":"array","items":{"type":"string"},"uniqueItems":true}},"additionalProperties":true}