{"format_version":1,"name":"startup","maturity":"startup","packs":["web-app","security-critical","analytics","observability","privacy","accessibility"],"skills":["agentic-app","codebase-audit","security-review","release","documentation"],"policies":["dependencies","security","ai-permissions","quality-gates"]}