{"format_version":1,"name":"agency","maturity":"production","packs":["web-app","design-system","marketing","analytics","seo","accessibility","privacy"],"skills":["agentic-app","product-design","design-system","design-system-compliance","marketing","competitive-research","release-review"],"policies":["dependencies","security","ai-permissions","quality-gates"]}